{
  "$schema": "schemas/api_config.schema.json",
  "version": "abc123def456",
  "enabled": false,
  "host": "127.0.0.1",
  "port": 8080,
  "update_interval_ms": 100,
  "cors_enabled": true,
  "max_connections": 10,
  "sampling_time_ms": 500,
  "last_calibration_file": "C:\\path\\to\\calibration_data.json"
}
